{
  "country": "CA",
  "denomination": "Gold Maple Leaf",
  "face_value": 50.0,
  "series": [
    {
      "series_id": "ca_gold_maple_leaf",
      "series_name": "Gold Maple Leaf",
      "official_name": "Gold Maple Leaf",
      "years": {
        "start": 1979,
        "end": 1979
      },
      "coins": [
        {
          "coin_id": "CA-GMPL-1979-P",
          "year": 1979,
          "mint": "P",
          "rarity": "common",
          "composition": {
            "gold": 0.999
          },
          "weight_grams": 31.103,
          "diameter_mm": 30.0,
          "varieties": [],
          "source_citation": "Issue #11 research",
          "notes": "1 oz, $50 face value",
          "obverse_description": "Queen Elizabeth II bust right",
          "reverse_description": "Single maple leaf",
          "distinguishing_features": "First 24-karat bullion coin",
          "identification_keywords": "Elizabeth II, maple leaf, gold, bullion",
          "common_names": "Gold Maple Leaf"
        }
      ]
    }
  ]
}